{
	"id": "urss",
	"nombre": "Unión Soviética (URSS)",
	"nombres": [
		"USSR"
	],
	"wikidata": "Q15180",
	"vinculos": [
		{
			"id": "rusia",
			"tipo": "predecesor",
			"hasta": 1922
		},
		{
			"id": "rusia",
			"tipo": "sucesor",
			"desde": 1991
		}
	],
	"gobernantes": [
		{
			"nombre": "Lenin",
			"titulo": "Presidente del Sovnarkom",
			"desde": 1917,
			"hasta": 1924
		},
		{
			"nombre": "Mijaíl Kalinin",
			"cargo": "jefe de Estado",
			"desde": 1922,
			"hasta": 1946
		},
		{
			"nombre": "Iósif Stalin",
			"titulo": "Secretario general del Partido Comunista",
			"desde": 1922,
			"hasta": 1953
		},
		{
			"nombre": "Alekséi Rýkov",
			"cargo": "jefe de gobierno",
			"desde": 1924,
			"hasta": 1930
		},
		{
			"nombre": "Viacheslav Mólotov",
			"cargo": "jefe de gobierno",
			"desde": 1930,
			"hasta": 1941
		},
		{
			"nombre": "Iósif Stalin",
			"cargo": "jefe de gobierno",
			"desde": 1941,
			"hasta": 1953
		},
		{
			"nombre": "Nikolái Shvérnik",
			"cargo": "jefe de Estado",
			"desde": 1946,
			"hasta": 1953
		},
		{
			"nombre": "Georgi Malenkov",
			"cargo": "jefe de gobierno",
			"desde": 1953,
			"hasta": 1955
		},
		{
			"nombre": "Kliment Voroshílov",
			"cargo": "jefe de Estado",
			"desde": 1953,
			"hasta": 1960
		},
		{
			"nombre": "Nikita Jruschov",
			"titulo": "Secretario general del PCUS",
			"desde": 1953,
			"hasta": 1964
		},
		{
			"nombre": "Nikolái Bulganin",
			"cargo": "jefe de gobierno",
			"desde": 1955,
			"hasta": 1958
		},
		{
			"nombre": "Nikita Jruschov",
			"cargo": "jefe de gobierno",
			"desde": 1958,
			"hasta": 1964
		},
		{
			"nombre": "Leonid Brézhnev",
			"cargo": "jefe de Estado",
			"desde": 1960,
			"hasta": 1964
		},
		{
			"nombre": "Anastás Mikoyán",
			"cargo": "jefe de Estado",
			"desde": 1964,
			"hasta": 1965
		},
		{
			"nombre": "Alekséi Kosygin",
			"cargo": "jefe de gobierno",
			"desde": 1964,
			"hasta": 1980
		},
		{
			"nombre": "Leonid Brézhnev",
			"titulo": "Secretario general del PCUS",
			"desde": 1964,
			"hasta": 1982
		},
		{
			"nombre": "Nikolái Podgorni",
			"cargo": "jefe de Estado",
			"desde": 1965,
			"hasta": 1977
		},
		{
			"nombre": "Leonid Brézhnev",
			"cargo": "jefe de Estado",
			"desde": 1977,
			"hasta": 1982
		},
		{
			"nombre": "Nikolái Aleksándrovich Tíjonov",
			"cargo": "jefe de gobierno",
			"desde": 1980,
			"hasta": 1985
		},
		{
			"nombre": "Vasili Kuznetsov",
			"cargo": "jefe de Estado",
			"desde": 1982,
			"hasta": 1983
		},
		{
			"nombre": "Yuri Andrópov",
			"cargo": "jefe de Estado",
			"desde": 1983,
			"hasta": 1984
		},
		{
			"nombre": "Vasili Kuznetsov",
			"cargo": "jefe de Estado",
			"desde": 1984,
			"hasta": 1984
		},
		{
			"nombre": "Konstantín Chernenko",
			"cargo": "jefe de Estado",
			"desde": 1984,
			"hasta": 1985
		},
		{
			"nombre": "Vasili Kuznetsov",
			"cargo": "jefe de Estado",
			"desde": 1985,
			"hasta": 1985
		},
		{
			"nombre": "Andréi Gromiko",
			"cargo": "jefe de Estado",
			"desde": 1985,
			"hasta": 1988
		},
		{
			"nombre": "Mijaíl Gorbachov",
			"titulo": "Secretario general del PCUS",
			"desde": 1985,
			"hasta": 1991
		},
		{
			"nombre": "Nikolái Rizhkov",
			"cargo": "jefe de gobierno",
			"desde": 1985,
			"hasta": 1991
		},
		{
			"nombre": "Mijaíl Gorbachov",
			"cargo": "jefe de Estado",
			"desde": 1988,
			"hasta": 1991
		},
		{
			"nombre": "Iván Siláyev",
			"cargo": "jefe de gobierno",
			"desde": 1991,
			"hasta": 1991
		},
		{
			"nombre": "Valentín Pávlov",
			"cargo": "jefe de gobierno",
			"desde": 1991,
			"hasta": 1991
		}
	],
	"poblacion": [
		{
			"anio": 1926,
			"valor": 147027915,
			"fuente": "Censo soviético de 1926 (Wikipedia (en): Demographics of the Soviet Union)"
		},
		{
			"anio": 1939,
			"valor": 170557093,
			"fuente": "Censo soviético de 1939 (Wikipedia (en): Demographics of the Soviet Union)"
		},
		{
			"anio": 1959,
			"valor": 208826650,
			"fuente": "Censo soviético de 1959 (Wikipedia (en): Demographics of the Soviet Union)"
		},
		{
			"anio": 1989,
			"valor": 293047571,
			"fuente": "Wikidata (P1082)"
		}
	],
	"escudos": [
		{
			"archivo": "Coat of arms of the Soviet Union (1923–1936).svg",
			"desde": 1923,
			"hasta": 1929
		},
		{
			"archivo": "Coat of arms of the Soviet Union (1931–1936).svg",
			"desde": 1931,
			"hasta": 1936
		},
		{
			"archivo": "Coat of arms of the Soviet Union (1936–1946).svg",
			"desde": 1936,
			"hasta": 1946
		},
		{
			"archivo": "Coat of arms of the Soviet Union (1946–1956).svg",
			"desde": 1946,
			"hasta": 1956
		},
		{
			"archivo": "Coat of arms of the Soviet Union (1956–1991).svg",
			"desde": 1956,
			"hasta": 1991
		}
	],
	"banderas": [
		{
			"archivo": "Flag of the Soviet Union (1922–1923).svg",
			"desde": 1922,
			"hasta": 1923
		},
		{
			"archivo": "Flag of the Soviet Union (1924).svg",
			"desde": 1923,
			"hasta": 1924
		},
		{
			"archivo": "Flag of the Soviet Union (1924–1936).svg",
			"desde": 1924,
			"hasta": 1936
		},
		{
			"archivo": "Flag of the Soviet Union (1936 – 1955).svg",
			"desde": 1936,
			"hasta": 1955
		},
		{
			"archivo": "Flag of the Soviet Union (dark version).svg",
			"desde": 1955,
			"hasta": 1980
		},
		{
			"archivo": "Flag of the Soviet Union.svg",
			"desde": 1955,
			"hasta": 1991
		}
	],
	"fuentes": [
		{
			"id": "wikipedia-es:Unión Soviética",
			"url": "https://es.wikipedia.org/wiki/Unión_Soviética",
			"licencia": "CC BY-SA"
		},
		{
			"id": "wikidata:Q229828",
			"url": "http://www.wikidata.org/entity/Q229828",
			"licencia": "CC0",
			"consultado": "2026-09-08"
		},
		{
			"id": "wikidata:Q1394",
			"url": "http://www.wikidata.org/entity/Q1394",
			"licencia": "CC0",
			"consultado": "2026-09-08"
		},
		{
			"id": "wikidata:Q294339",
			"url": "http://www.wikidata.org/entity/Q294339",
			"licencia": "CC0",
			"consultado": "2026-09-08"
		},
		{
			"id": "wikidata:Q132899",
			"url": "http://www.wikidata.org/entity/Q132899",
			"licencia": "CC0",
			"consultado": "2026-09-08"
		},
		{
			"id": "wikidata:Q855",
			"url": "http://www.wikidata.org/entity/Q855",
			"licencia": "CC0",
			"consultado": "2026-09-08"
		},
		{
			"id": "wikidata:Q355639",
			"url": "http://www.wikidata.org/entity/Q355639",
			"licencia": "CC0",
			"consultado": "2026-09-08"
		},
		{
			"id": "wikidata:Q180588",
			"url": "http://www.wikidata.org/entity/Q180588",
			"licencia": "CC0",
			"consultado": "2026-09-08"
		},
		{
			"id": "wikidata:Q186185",
			"url": "http://www.wikidata.org/entity/Q186185",
			"licencia": "CC0",
			"consultado": "2026-09-08"
		},
		{
			"id": "wikidata:Q48093",
			"url": "http://www.wikidata.org/entity/Q48093",
			"licencia": "CC0",
			"consultado": "2026-09-08"
		},
		{
			"id": "wikidata:Q35314",
			"url": "http://www.wikidata.org/entity/Q35314",
			"licencia": "CC0",
			"consultado": "2026-09-08"
		},
		{
			"id": "wikidata:Q765165",
			"url": "http://www.wikidata.org/entity/Q765165",
			"licencia": "CC0",
			"consultado": "2026-09-08"
		},
		{
			"id": "wikidata:Q152738",
			"url": "http://www.wikidata.org/entity/Q152738",
			"licencia": "CC0",
			"consultado": "2026-09-08"
		},
		{
			"id": "wikidata:Q202770",
			"url": "http://www.wikidata.org/entity/Q202770",
			"licencia": "CC0",
			"consultado": "2026-09-08"
		},
		{
			"id": "wikidata:Q295781",
			"url": "http://www.wikidata.org/entity/Q295781",
			"licencia": "CC0",
			"consultado": "2026-09-08"
		},
		{
			"id": "wikidata:Q315518",
			"url": "http://www.wikidata.org/entity/Q315518",
			"licencia": "CC0",
			"consultado": "2026-09-08"
		},
		{
			"id": "wikidata:Q325038",
			"url": "http://www.wikidata.org/entity/Q325038",
			"licencia": "CC0",
			"consultado": "2026-09-08"
		},
		{
			"id": "wikidata:Q44071",
			"url": "http://www.wikidata.org/entity/Q44071",
			"licencia": "CC0",
			"consultado": "2026-09-08"
		},
		{
			"id": "wikidata:Q127442",
			"url": "http://www.wikidata.org/entity/Q127442",
			"licencia": "CC0",
			"consultado": "2026-09-08"
		},
		{
			"id": "wikidata:Q184267",
			"url": "http://www.wikidata.org/entity/Q184267",
			"licencia": "CC0",
			"consultado": "2026-09-08"
		},
		{
			"id": "wikidata:Q366524",
			"url": "http://www.wikidata.org/entity/Q366524",
			"licencia": "CC0",
			"consultado": "2026-09-08"
		},
		{
			"id": "wikidata:Q30487",
			"url": "http://www.wikidata.org/entity/Q30487",
			"licencia": "CC0",
			"consultado": "2026-09-08"
		},
		{
			"id": "wikidata:Q435367",
			"url": "http://www.wikidata.org/entity/Q435367",
			"licencia": "CC0",
			"consultado": "2026-09-08"
		},
		{
			"id": "wikidata:Q714552",
			"url": "http://www.wikidata.org/entity/Q714552",
			"licencia": "CC0",
			"consultado": "2026-09-08"
		},
		{
			"id": "wikidata:P1082:Q15180",
			"url": "https://www.wikidata.org/wiki/Q15180",
			"licencia": "CC0",
			"consultado": "2026-09-08"
		},
		{
			"id": "wikidata:P94:Q15180",
			"url": "https://www.wikidata.org/wiki/Q15180",
			"licencia": "CC0",
			"consultado": "2026-09-08"
		},
		{
			"id": "wikidata:P41:Q15180",
			"url": "https://www.wikidata.org/wiki/Q15180",
			"licencia": "CC0",
			"consultado": "2026-09-28"
		},
		{
			"id": "wikipedia-es:Iósif Stalin",
			"url": "https://es.wikipedia.org/wiki/I%C3%B3sif_Stalin",
			"licencia": "CC BY-SA",
			"consultado": "2026-09-28"
		},
		{
			"id": "wikipedia-en:Demographics of the Soviet Union",
			"url": "https://en.wikipedia.org/wiki/Demographics_of_the_Soviet_Union",
			"licencia": "CC BY-SA",
			"consultado": "2026-09-28"
		}
	],
	"revision": {
		"estado": "borrador",
		"fecha": "2026-09-28",
		"por": "panel-admin",
		"hash": "38a9adc98289",
		"secciones": [
			"banderas",
			"escudos",
			"gobernantes",
			"poblacion"
		]
	}
}
