{
	"id": "papua-nueva-guinea",
	"nombre": "Papúa Nueva Guinea",
	"nombres": [
		"Papua New Guinea"
	],
	"wiki": "es:Papúa Nueva Guinea",
	"wikidata": "Q691",
	"owid": "PNG",
	"resena": "Papúa Nueva Guinea, oficialmente denominado Estado Independiente de Papúa Nueva Guinea, es un país soberano de Oceanía que ocupa la mitad oriental de la isla de Nueva Guinea y una numerosa cantidad de islas situadas alrededor de esta. La otra mitad de la isla pertenece a Indonesia, y se compone de la región denominada Nueva Guinea Occidental.",
	"gobernantes": [
		{
			"nombre": "Peter O'Neill",
			"cargo": "jefe de gobierno",
			"desde": 2011,
			"hasta": 2019
		},
		{
			"nombre": "James Marape",
			"cargo": "jefe de gobierno",
			"desde": 2019,
			"hasta": 2019
		},
		{
			"nombre": "Carlos III del Reino Unido",
			"cargo": "jefe de Estado",
			"desde": 2022,
			"hasta": 2022
		}
	],
	"poblacion": [
		{
			"anio": -10000,
			"valor": 9694
		},
		{
			"anio": -9000,
			"valor": 14541
		},
		{
			"anio": -8000,
			"valor": 21812
		},
		{
			"anio": -7000,
			"valor": 32719
		},
		{
			"anio": -6000,
			"valor": 49078
		},
		{
			"anio": -5000,
			"valor": 73618
		},
		{
			"anio": -4000,
			"valor": 110427
		},
		{
			"anio": -3000,
			"valor": 165641
		},
		{
			"anio": -2000,
			"valor": 248462
		},
		{
			"anio": -1000,
			"valor": 372693
		},
		{
			"anio": 0,
			"valor": 559040
		},
		{
			"anio": 100,
			"valor": 585661
		},
		{
			"anio": 200,
			"valor": 613549
		},
		{
			"anio": 300,
			"valor": 642766
		},
		{
			"anio": 400,
			"valor": 673374
		},
		{
			"anio": 500,
			"valor": 705439
		},
		{
			"anio": 600,
			"valor": 739032
		},
		{
			"anio": 700,
			"valor": 774224
		},
		{
			"anio": 800,
			"valor": 811092
		},
		{
			"anio": 900,
			"valor": 849715
		},
		{
			"anio": 1000,
			"valor": 890178
		},
		{
			"anio": 1100,
			"valor": 932567
		},
		{
			"anio": 1200,
			"valor": 976975
		},
		{
			"anio": 1300,
			"valor": 1023498
		},
		{
			"anio": 1400,
			"valor": 1072236
		},
		{
			"anio": 1500,
			"valor": 1123295
		},
		{
			"anio": 1600,
			"valor": 1176785
		},
		{
			"anio": 1700,
			"valor": 1232822
		},
		{
			"anio": 1750,
			"valor": 1253577
		},
		{
			"anio": 1800,
			"valor": 754894
		},
		{
			"anio": 1850,
			"valor": 763498
		},
		{
			"anio": 1900,
			"valor": 841827
		},
		{
			"anio": 1910,
			"valor": 833850
		},
		{
			"anio": 1920,
			"valor": 554530
		},
		{
			"anio": 1930,
			"valor": 592614
		},
		{
			"anio": 1940,
			"valor": 953522
		},
		{
			"anio": 1950,
			"valor": 1543441
		},
		{
			"anio": 1960,
			"valor": 1995115
		},
		{
			"anio": 1970,
			"valor": 2505632
		},
		{
			"anio": 1980,
			"valor": 3131516
		},
		{
			"anio": 1990,
			"valor": 3896482
		},
		{
			"anio": 2000,
			"valor": 5537068
		},
		{
			"anio": 2010,
			"valor": 7633524
		},
		{
			"anio": 2020,
			"valor": 9815743
		},
		{
			"anio": 2023,
			"valor": 10389638
		}
	],
	"escudos": [
		{
			"archivo": "National emblem of Papua New Guinea.svg"
		}
	],
	"banderas": [
		{
			"archivo": "Flag of Papua New Guinea.svg"
		}
	],
	"fuentes": [
		{
			"id": "Wikidata:Q691",
			"url": "https://www.wikidata.org/wiki/Q691",
			"consultado": "2026-09"
		},
		{
			"id": "owid:population",
			"url": "https://ourworldindata.org/grapher/population",
			"licencia": "CC BY (HYDE, Gapminder, ONU)",
			"consultado": "2026-09-08"
		},
		{
			"id": "Wikipedia (es): Papúa Nueva Guinea",
			"url": "https://es.wikipedia.org/wiki/Pap%C3%BAa_Nueva_Guinea",
			"licencia": "CC BY-SA",
			"consultado": "2026-09-08"
		},
		{
			"id": "wikidata:P94:Q691",
			"url": "https://www.wikidata.org/wiki/Q691",
			"licencia": "CC0",
			"consultado": "2026-09-09"
		},
		{
			"id": "wikidata:Q57892",
			"url": "http://www.wikidata.org/entity/Q57892",
			"licencia": "CC0",
			"consultado": "2026-09-09"
		},
		{
			"id": "wikidata:Q6138903",
			"url": "http://www.wikidata.org/entity/Q6138903",
			"licencia": "CC0",
			"consultado": "2026-09-09"
		},
		{
			"id": "wikidata:Q43274",
			"url": "http://www.wikidata.org/entity/Q43274",
			"licencia": "CC0",
			"consultado": "2026-09-09"
		},
		{
			"id": "wikidata:P41:Q691",
			"url": "https://www.wikidata.org/wiki/Q691",
			"licencia": "CC0",
			"consultado": "2026-09-10"
		}
	],
	"revision": {
		"estado": "validado",
		"fecha": "2026-09-26",
		"por": "panel-admin",
		"hash": "805f259dc56d",
		"secciones": [
			"banderas",
			"escudos",
			"gobernantes",
			"poblacion",
			"resena"
		]
	}
}
