{
	"id": "guinea",
	"nombre": "Guinea",
	"nombres": [
		"Guinea"
	],
	"nombres_periodo": [
		{
			"nombre": "Imamato de Futa Yallon",
			"desde": 1727,
			"hasta": 1896
		},
		{
			"nombre": "Guinea Francesa",
			"desde": 1891,
			"hasta": 1958
		},
		{
			"nombre": "República de Guinea",
			"desde": 1958,
			"hasta": 2026
		}
	],
	"wiki": "es:Guinea",
	"wikidata": "Q1006",
	"relacionados": [
		"Guinea-Conakri",
		"Guinea Francesa",
		"República de Guinea"
	],
	"resena": "Guinea, oficialmente la República de Guinea, frecuentemente llamada Guinea-Conakri para diferenciarla de otros dos países africanos, su vecino Guinea-Bisáu y Guinea Ecuatorial, es un país de África occidental, antiguamente conocido como Guinea Francesa.",
	"gobernantes": [
		{
			"nombre": "Ahmed Sékou Touré",
			"cargo": "Presidente",
			"desde": 1958,
			"hasta": 1984
		},
		{
			"nombre": "Lansana Conté",
			"cargo": "Presidente",
			"desde": 1984,
			"hasta": 2008
		},
		{
			"nombre": "Moussa Dadis Camara",
			"cargo": "Presidente (junta militar)",
			"desde": 2008,
			"hasta": 2009
		},
		{
			"nombre": "Sékouba Konaté",
			"cargo": "Presidente interino",
			"desde": 2009,
			"hasta": 2010
		},
		{
			"nombre": "Alpha Condé",
			"cargo": "Presidente",
			"desde": 2010,
			"hasta": 2021
		},
		{
			"nombre": "Mamadi Doumbouya",
			"cargo": "Presidente de transición",
			"desde": 2021,
			"hasta": 2026
		}
	],
	"poblacion": [
		{
			"anio": 1901,
			"valor": 1500000,
			"fuente": "Wikipedia (es)"
		},
		{
			"anio": 1926,
			"valor": 2100000,
			"fuente": "Wikipedia (es), censo"
		},
		{
			"anio": 1950,
			"valor": 2700000,
			"fuente": "Wikipedia (es)"
		},
		{
			"anio": 1983,
			"valor": 4500000,
			"fuente": "Wikipedia (es), censo"
		},
		{
			"anio": 2000,
			"valor": 7500000,
			"fuente": "Wikipedia (es)"
		},
		{
			"anio": 2010,
			"valor": 10100000,
			"fuente": "Wikipedia (es)"
		},
		{
			"anio": 2023,
			"valor": 13900000,
			"fuente": "Our World in Data (est.)"
		}
	],
	"escudos": [
		{
			"archivo": "Coat of arms of Guinea.svg"
		}
	],
	"banderas": [
		{
			"archivo": "Flag of Guinea.svg"
		}
	],
	"fuentes": [
		{
			"id": "wikipedia-es:Guinea",
			"url": "https://es.wikipedia.org/wiki/Guinea",
			"licencia": "CC BY-SA",
			"consultado": "2026-09"
		},
		{
			"id": "wikidata:Q1006",
			"url": "https://www.wikidata.org/wiki/Q1006",
			"licencia": "CC0",
			"consultado": "2026-09"
		},
		{
			"id": "wikipedia-es:Guinea",
			"url": "https://es.wikipedia.org/wiki/Guinea",
			"licencia": "CC BY-SA",
			"consultado": "2026-09-08"
		},
		{
			"id": "wikidata:Q1006",
			"url": "https://www.wikidata.org/wiki/Q1006",
			"licencia": "CC0",
			"consultado": "2026-09-08"
		},
		{
			"id": "wikidata:Q1006",
			"url": "https://www.wikidata.org/wiki/Q1006",
			"licencia": "CC0",
			"consultado": "2026-09-10"
		}
	],
	"revision": {
		"estado": "validado",
		"fecha": "2026-09-26",
		"por": "panel-admin",
		"hash": "5149775c13ed",
		"secciones": [
			"banderas",
			"escudos",
			"fuentes",
			"gobernantes",
			"nombres_periodo",
			"poblacion",
			"resena"
		]
	}
}
