{
	"id": "somalia",
	"nombre": "Somalia",
	"nombres": [
		"Somalia",
		"Italian Somaliland"
	],
	"nombres_periodo": [
		{
			"nombre": "Somalilandia italiana y británica (colonias)",
			"desde": 1889,
			"hasta": 1960
		},
		{
			"nombre": "República Somalí",
			"desde": 1960,
			"hasta": 1969
		},
		{
			"nombre": "República Democrática Somalí",
			"desde": 1969,
			"hasta": 1991
		},
		{
			"nombre": "República Federal de Somalia",
			"desde": 2012
		}
	],
	"wiki": "es:Somalia",
	"wikidata": "Q1045",
	"relacionados": [
		"República Federal de Somalia",
		"República Democrática Somalí",
		"Somalia italiana"
	],
	"resena": "Somalia, cuyo nombre oficial es República Federal de Somalia, es un país ubicado en el Cuerno de África, al este del continente africano. Limita al oeste y noroeste con Etiopía y Yibuti, al sur con Kenia, al norte con el golfo de Adén, y al este con el océano Índico.",
	"gobernantes": [
		{
			"nombre": "Aden Abdullah Osman Daar",
			"cargo": "Presidente",
			"desde": 1960,
			"hasta": 1967
		},
		{
			"nombre": "Abdirashid Ali Shermarke",
			"cargo": "Presidente",
			"desde": 1967,
			"hasta": 1969
		},
		{
			"nombre": "Mohamed Siad Barre",
			"cargo": "Presidente",
			"desde": 1969,
			"hasta": 1991
		},
		{
			"nombre": "Ali Mahdi Muhammad",
			"cargo": "Presidente interino (disputado)",
			"desde": 1991,
			"hasta": 1997
		},
		{
			"nombre": "Abdiqasim Salad Hassan",
			"cargo": "Presidente (Gobierno Nacional de Transición)",
			"desde": 2000,
			"hasta": 2004
		},
		{
			"nombre": "Abdullahi Yusuf Ahmed",
			"cargo": "Presidente (Gobierno Federal de Transición)",
			"desde": 2004,
			"hasta": 2008
		},
		{
			"nombre": "Sharif Sheikh Ahmed",
			"cargo": "Presidente (Gobierno Federal de Transición)",
			"desde": 2009,
			"hasta": 2012
		},
		{
			"nombre": "Hassan Sheikh Mohamud",
			"cargo": "Presidente",
			"desde": 2012,
			"hasta": 2017
		},
		{
			"nombre": "Mohamed Abdullahi Mohamed (Farmaajo)",
			"cargo": "Presidente",
			"desde": 2017,
			"hasta": 2022
		},
		{
			"nombre": "Hassan Sheikh Mohamud",
			"cargo": "Presidente",
			"desde": 2022,
			"hasta": 2026
		}
	],
	"poblacion": [
		{
			"anio": 1975,
			"valor": 3253024,
			"fuente": "Censo de Somalia 1975"
		},
		{
			"anio": 1987,
			"valor": 7114431,
			"fuente": "Censo de Somalia 1987 (disputado)"
		},
		{
			"anio": 2000,
			"valor": 8900000,
			"fuente": "Estimación ONU"
		},
		{
			"anio": 2014,
			"valor": 12316895,
			"fuente": "Estimación UNFPA (PESS)"
		},
		{
			"anio": 2020,
			"valor": 15900000,
			"fuente": "Estimación ONU"
		},
		{
			"anio": 2023,
			"valor": 18143378,
			"fuente": "Estimación (Wikipedia es)"
		}
	],
	"escudos": [
		{
			"archivo": "Coat of arms of Somalia.svg"
		}
	],
	"banderas": [
		{
			"archivo": "Flag of Somalia.svg"
		}
	],
	"fuentes": [
		{
			"id": "wikipedia-es:Somalia",
			"url": "https://es.wikipedia.org/wiki/Somalia",
			"licencia": "CC BY-SA",
			"consultado": "2026-09"
		},
		{
			"id": "wikidata:Q1045",
			"url": "https://www.wikidata.org/wiki/Q1045",
			"licencia": "CC0",
			"consultado": "2026-09"
		},
		{
			"id": "wikipedia-es:Somalia",
			"url": "https://es.wikipedia.org/wiki/Somalia",
			"licencia": "CC BY-SA",
			"consultado": "2026-09-08"
		},
		{
			"id": "wikidata:Q1045",
			"url": "https://www.wikidata.org/wiki/Q1045",
			"licencia": "CC0",
			"consultado": "2026-09-09"
		},
		{
			"id": "wikidata:Q1045",
			"url": "https://www.wikidata.org/wiki/Q1045",
			"licencia": "CC0",
			"consultado": "2026-09-10"
		}
	],
	"revision": {
		"estado": "validado",
		"fecha": "2026-09-26",
		"por": "panel-admin",
		"hash": "16f152aa9fdd",
		"secciones": [
			"banderas",
			"escudos",
			"fuentes",
			"gobernantes",
			"nombres_periodo",
			"poblacion",
			"resena"
		]
	}
}
