{
	"id": "yibuti",
	"nombre": "Yibuti",
	"nombres": [
		"Djibouti"
	],
	"nombres_periodo": [
		{
			"nombre": "Somalilandia Francesa",
			"desde": 1896,
			"hasta": 1967
		},
		{
			"nombre": "Territorio Francés de los Afars y los Issas",
			"desde": 1967,
			"hasta": 1977
		},
		{
			"nombre": "República de Yibuti",
			"desde": 1977,
			"hasta": 2026
		}
	],
	"wiki": "es:Yibuti",
	"wikidata": "Q977",
	"relacionados": [
		"Somalilandia Francesa",
		"Territorio Frances de los Afars y los Issas"
	],
	"resena": "Yibuti, oficialmente denominado República de Yibuti, es un país ubicado en el Cuerno de África. Tiene 23.200 km² y comparte fronteras con Eritrea por el norte, con Etiopía por el oeste y el sur, y con Somalia por el sureste.",
	"gobernantes": [
		{
			"nombre": "Hassan Gouled Aptidon",
			"cargo": "Presidente",
			"desde": 1977,
			"hasta": 1999
		},
		{
			"nombre": "Ismail Omar Guelleh",
			"cargo": "Presidente",
			"desde": 1999,
			"hasta": 2026
		}
	],
	"poblacion": [
		{
			"anio": 1960,
			"valor": 83000,
			"fuente": "Wikipedia (es), estimacion"
		},
		{
			"anio": 2009,
			"valor": 818159,
			"fuente": "Censo 2009 (Wikipedia)"
		},
		{
			"anio": 2016,
			"valor": 846000,
			"fuente": "Wikipedia (es), estimacion"
		},
		{
			"anio": 2023,
			"valor": 1136455,
			"fuente": "Wikipedia (es), estimacion"
		}
	],
	"escudos": [
		{
			"archivo": "Emblem of Djibouti.svg"
		}
	],
	"banderas": [
		{
			"archivo": "Flag of Djibouti.svg"
		}
	],
	"fuentes": [
		{
			"id": "wikipedia-es",
			"url": "https://es.wikipedia.org/wiki/Yibuti",
			"consultado": "2026-09"
		},
		{
			"id": "wikidata",
			"url": "https://www.wikidata.org/wiki/Q977",
			"consultado": "2026-09"
		},
		{
			"id": "Wikipedia (es): Yibuti",
			"url": "https://es.wikipedia.org/wiki/Yibuti",
			"licencia": "CC BY-SA",
			"consultado": "2026-09-08"
		},
		{
			"id": "wikidata:P94:Q977",
			"url": "https://www.wikidata.org/wiki/Q977",
			"licencia": "CC0",
			"consultado": "2026-09-08"
		},
		{
			"id": "wikidata:P41:Q977",
			"url": "https://www.wikidata.org/wiki/Q977",
			"licencia": "CC0",
			"consultado": "2026-09-28"
		}
	],
	"revision": {
		"estado": "validado",
		"fecha": "2026-09-28",
		"por": "panel-admin",
		"hash": "5d9ca0b71401",
		"secciones": [
			"banderas",
			"escudos",
			"fuentes",
			"gobernantes",
			"nombres_periodo",
			"poblacion",
			"resena"
		]
	}
}
