{
	"id": "kirguistan",
	"nombre": "Kirguistán",
	"nombres": [
		"Kyrgyzstan"
	],
	"wiki": "es:Kirguistán",
	"wikidata": "Q813",
	"owid": "KGZ",
	"relacionados": [
		"Kirguizistán"
	],
	"resena": "Kirguistán o Kirguizistán, oficialmente República Kirguisa ,es un país montañoso, sin litoral, ubicado en Asia Central. Comparte fronteras con Kazajistán al norte, con China al este, con Tayikistán al sur y Uzbekistán al oeste.",
	"gobernantes": [
		{
			"nombre": "Kurmanbek Bakíev",
			"cargo": "jefe de Estado",
			"desde": 2005,
			"hasta": 2010
		},
		{
			"nombre": "Rosa Otunbáeva",
			"cargo": "jefe de Estado",
			"desde": 2010,
			"hasta": 2011
		},
		{
			"nombre": "Almazbek Atambayev",
			"cargo": "jefe de Estado",
			"desde": 2011,
			"hasta": 2017
		},
		{
			"nombre": "Sooronbay Jeenbekov",
			"cargo": "jefe de gobierno",
			"desde": 2016,
			"hasta": 2017
		},
		{
			"nombre": "Sapar Isakov",
			"cargo": "jefe de gobierno",
			"desde": 2017,
			"hasta": 2018
		},
		{
			"nombre": "Sooronbay Jeenbekov",
			"cargo": "jefe de Estado",
			"desde": 2017,
			"hasta": 2020
		},
		{
			"nombre": "Muhammetkaliy Abulgaziyev",
			"cargo": "jefe de gobierno",
			"desde": 2018,
			"hasta": 2020
		},
		{
			"nombre": "Kubatbek Boronov",
			"cargo": "jefe de gobierno",
			"desde": 2020,
			"hasta": 2020
		},
		{
			"nombre": "Sadyr Zhaparov",
			"cargo": "jefe de gobierno",
			"desde": 2020,
			"hasta": 2020
		},
		{
			"nombre": "Artjom Nowikow",
			"cargo": "jefe de gobierno",
			"desde": 2020,
			"hasta": 2021
		},
		{
			"nombre": "Sadyr Zhaparov",
			"cargo": "jefe de Estado",
			"desde": 2021,
			"hasta": 2021
		},
		{
			"nombre": "Ulukbek Maripov",
			"cargo": "jefe de gobierno",
			"desde": 2021,
			"hasta": 2021
		},
		{
			"nombre": "Akylbek Japarov",
			"cargo": "jefe de gobierno",
			"desde": 2021,
			"hasta": 2024
		},
		{
			"nombre": "Adylbek Kasymaliev",
			"cargo": "jefe de gobierno",
			"desde": 2024,
			"hasta": 2024
		}
	],
	"poblacion": [
		{
			"anio": -10000,
			"valor": 28350
		},
		{
			"anio": -9000,
			"valor": 33075
		},
		{
			"anio": -8000,
			"valor": 38587
		},
		{
			"anio": -7000,
			"valor": 45018
		},
		{
			"anio": -6000,
			"valor": 52522
		},
		{
			"anio": -5000,
			"valor": 61275
		},
		{
			"anio": -4000,
			"valor": 71488
		},
		{
			"anio": -3000,
			"valor": 83403
		},
		{
			"anio": -2000,
			"valor": 97303
		},
		{
			"anio": -1000,
			"valor": 113520
		},
		{
			"anio": 0,
			"valor": 132440
		},
		{
			"anio": 100,
			"valor": 141900
		},
		{
			"anio": 200,
			"valor": 152036
		},
		{
			"anio": 300,
			"valor": 162896
		},
		{
			"anio": 400,
			"valor": 174531
		},
		{
			"anio": 500,
			"valor": 186998
		},
		{
			"anio": 600,
			"valor": 200355
		},
		{
			"anio": 700,
			"valor": 214666
		},
		{
			"anio": 800,
			"valor": 230000
		},
		{
			"anio": 900,
			"valor": 240000
		},
		{
			"anio": 1000,
			"valor": 250000
		},
		{
			"anio": 1100,
			"valor": 270000
		},
		{
			"anio": 1200,
			"valor": 290000
		},
		{
			"anio": 1300,
			"valor": 310000
		},
		{
			"anio": 1400,
			"valor": 330000
		},
		{
			"anio": 1500,
			"valor": 350000
		},
		{
			"anio": 1600,
			"valor": 400000
		},
		{
			"anio": 1700,
			"valor": 450000
		},
		{
			"anio": 1750,
			"valor": 590103
		},
		{
			"anio": 1800,
			"valor": 530343
		},
		{
			"anio": 1850,
			"valor": 697603
		},
		{
			"anio": 1900,
			"valor": 1100576
		},
		{
			"anio": 1910,
			"valor": 1205653
		},
		{
			"anio": 1920,
			"valor": 1320825
		},
		{
			"anio": 1930,
			"valor": 1447162
		},
		{
			"anio": 1940,
			"valor": 1585583
		},
		{
			"anio": 1950,
			"valor": 1751141
		},
		{
			"anio": 1960,
			"valor": 2215517
		},
		{
			"anio": 1970,
			"valor": 3025143
		},
		{
			"anio": 1980,
			"valor": 3729372
		},
		{
			"anio": 1990,
			"valor": 4459545
		},
		{
			"anio": 2000,
			"valor": 5025150
		},
		{
			"anio": 2010,
			"valor": 5491763
		},
		{
			"anio": 2020,
			"valor": 6664143
		},
		{
			"anio": 2023,
			"valor": 7073523
		}
	],
	"escudos": [
		{
			"archivo": "Emblem of Kyrgyzstan.svg"
		}
	],
	"banderas": [
		{
			"archivo": "Flag of the Kirghiz Soviet Socialist Republic (1952–1991); Flag of Kyrgyzstan (1991–1992).svg",
			"desde": 1952,
			"hasta": 1992
		},
		{
			"archivo": "Flag of Kyrgyzstan (1992–2023).svg",
			"desde": 1992,
			"hasta": 2023
		},
		{
			"archivo": "Flag of Kyrgyzstan.svg",
			"desde": 2023
		}
	],
	"fuentes": [
		{
			"id": "wikidata:Q813",
			"url": "https://www.wikidata.org/wiki/Q813",
			"licencia": "CC0",
			"consultado": "2026-09"
		},
		{
			"id": "datos:owid-poblacion",
			"consultado": "2026-09-08"
		},
		{
			"id": "wikipedia-es:Kirguistán",
			"url": "https://es.wikipedia.org/wiki/Kirguist%C3%A1n",
			"licencia": "CC BY-SA",
			"consultado": "2026-09-08"
		},
		{
			"id": "wikidata:Q813",
			"url": "https://www.wikidata.org/wiki/Q813",
			"licencia": "CC0",
			"consultado": "2026-09-09"
		},
		{
			"id": "wikidata:Q484816",
			"url": "http://www.wikidata.org/entity/Q484816",
			"licencia": "CC0",
			"consultado": "2026-09-09"
		},
		{
			"id": "wikidata:Q485136",
			"url": "http://www.wikidata.org/entity/Q485136",
			"licencia": "CC0",
			"consultado": "2026-09-09"
		},
		{
			"id": "wikidata:Q24692",
			"url": "http://www.wikidata.org/entity/Q24692",
			"licencia": "CC0",
			"consultado": "2026-09-09"
		},
		{
			"id": "wikidata:Q23810819",
			"url": "http://www.wikidata.org/entity/Q23810819",
			"licencia": "CC0",
			"consultado": "2026-09-09"
		},
		{
			"id": "wikidata:Q29865128",
			"url": "http://www.wikidata.org/entity/Q29865128",
			"licencia": "CC0",
			"consultado": "2026-09-09"
		},
		{
			"id": "wikidata:Q37777535",
			"url": "http://www.wikidata.org/entity/Q37777535",
			"licencia": "CC0",
			"consultado": "2026-09-09"
		},
		{
			"id": "wikidata:Q96338578",
			"url": "http://www.wikidata.org/entity/Q96338578",
			"licencia": "CC0",
			"consultado": "2026-09-09"
		},
		{
			"id": "wikidata:Q25597826",
			"url": "http://www.wikidata.org/entity/Q25597826",
			"licencia": "CC0",
			"consultado": "2026-09-09"
		},
		{
			"id": "wikidata:Q101751482",
			"url": "http://www.wikidata.org/entity/Q101751482",
			"licencia": "CC0",
			"consultado": "2026-09-09"
		},
		{
			"id": "wikidata:Q105277058",
			"url": "http://www.wikidata.org/entity/Q105277058",
			"licencia": "CC0",
			"consultado": "2026-09-09"
		},
		{
			"id": "wikidata:Q4060344",
			"url": "http://www.wikidata.org/entity/Q4060344",
			"licencia": "CC0",
			"consultado": "2026-09-09"
		},
		{
			"id": "wikidata:Q112703041",
			"url": "http://www.wikidata.org/entity/Q112703041",
			"licencia": "CC0",
			"consultado": "2026-09-09"
		},
		{
			"id": "wikidata:Q813",
			"url": "https://www.wikidata.org/wiki/Q813",
			"licencia": "CC0",
			"consultado": "2026-09-10"
		}
	],
	"revision": {
		"estado": "validado",
		"fecha": "2026-09-26",
		"por": "panel-admin",
		"hash": "a1d83678c52d",
		"secciones": [
			"banderas",
			"escudos",
			"gobernantes",
			"poblacion",
			"resena"
		]
	}
}
